{
  "evolution_api": {
    "api_url": "https://evolution.jclee.me",
    "api_key": "YOUR_EVOLUTION_API_KEY",
    "instance_name": "resume-bot",
    "whatsapp_number": "821012345678"
  },
  "google_sheets": {
    "spreadsheet_id": "GOOGLE_SHEET_ID_HERE_44_CHARS",
    "spreadsheet_name": "Resume Monitoring",
    "sheets": {
      "downtime_log": {
        "gid": "gid=0",
        "name": "Downtime Log"
      },
      "health_log": {
        "gid": "gid=1",
        "name": "Health Log"
      },
      "deployment_log": {
        "gid": "gid=2",
        "name": "Deployment Log"
      }
    },
    "credential_id": "2",
    "credential_name": "Google Sheets account"
  },
  "monitoring": {
    "site_url": "https://resume.jclee.me",
    "health_endpoint": "https://resume.jclee.me/health",
    "metrics_endpoint": "https://resume.jclee.me/metrics",
    "grafana_dashboard_url": "https://grafana.jclee.me/d/resume",
    "loki_url": "https://loki.jclee.me/loki/api/v1/push",
    "health_check_interval": "*/5 * * * *",
    "http_timeout": 10000,
    "http_retry_max_tries": 3
  },
  "github": {
    "webhook_path": "resume-deploy",
    "repository": "qws941/resume"
  }
}
